{
  "schema_version": "zentinel.pipeline.active_lock.v1",
  "task_id": "126",
  "state": "active",
  "queue_order": "081",
  "queue_file": "tasks/queue.json",
  "status_file": "tasks/status.json",
  "context_packet": "artifacts/pipeline/126/context/orchestrator.json",
  "created_by_role": "Orchestrator",
  "source_commit": "b161a274b2ec8fbb7ba62736b97fa95e0239b6b8",
  "working_tree_state": "dirty"
}
