{
  "schema_version": "zentinel.pipeline.active_lock.v1",
  "task_id": "064",
  "state": "active",
  "queue_order": "059.4",
  "queue_file": "tasks/queue.json",
  "status_file": "tasks/status.json",
  "context_packet": "artifacts/pipeline/064/context/orchestrator.json",
  "created_by_role": "Task Queue Manager",
  "source_commit": "0000000000000000000000000000000000000000",
  "working_tree_state": "clean"
}
